fy_rec'd,epa_file_#,summary_status,_merge,named_entity,clean_date_received,recent_status_date,time_difference,detailed_status,primary_status_map,simplified_status,compare_statuses,reason_for_rejection_if_applicable,presidential_administration,environmental_justice_issue_cited,city,state,zip_code,community_impacted,referred_agency,is_unique,filed_by_a_lawyer,group_filing,filed_on_behalf_of,epa_initiated_compliance_review,complaint_about_environmental_justice_matter,notes_on_ej_categorization,more_than_one_complaint,total_related_complaints,related_complaint_numbers,complaint_link,notes,additional_notes,disc_basis_1,disc_basis_2,related_documents,origin,final_adjudication_&_reason,disc_basis_3,disc_basis_4,disc_basis_5
fy18,02r-18-r9,closed,both,los angeles unified school dist.,2018-05-15,2018-06-01,17.0,rejected 6/1/2018: lack of jurisdiction and untimely,rejected,rejected,True,"Lack of jurisdiction, untimely",Trump,"Three Los Angeles Unified School District schools are within the radius of a leak from underground gas storage tanks, threatening the health of staff/students there",Los Angeles,CA,multiple,Not mentioned,,yes,No,Redacted individual,,No,Yes,"No mention of a protected class, but the school district is 90 percent students of color",,1.0,,https://www.epa.gov/system/files/documents/2022-09/02R-18-R9%20Complaint%20Redacted.pdf,Complaint attachments: https://www.epa.gov/system/files/documents/2022-09/02R-18-R9%20Complt%20Attachments%20Redacted.pdf. It includes an analysis from the state's Health and Human Services Agency about the soil contamination at one of the schools that suggests it doesn't pose health risks there.,,race, national origin,02r-18-r9 complaint (pdf) (269.13 kb) 02r-18-r9 complaint attachments (pdf) (16.72 mb),epa,,,,
fy18,01r-18-r4,closed,both,north carolina deq,2018-03-28,2023-06-13,1903.0,rejected without prejudice 4/20/2018: pending w/state agency,rejected,rejected,True,pending with state agency,Trump,"Agency issued a permit for a business park stormwater system that will discriminate against the ""West Badin African American community and on people of color who swim, fish, and recreate in Badin Lake, near the site."" The group challenged the permit at the state level but also filed with EPA so they wouldn't miss the timeliness deadline to file.",Badin,NC,28009,Black community in West Badin,,yes,Yes (or at least involved one),Concerned Citizens of West Badin Community,,No,Yes,,,1.0,,https://www.epa.gov/system/files/documents/2022-09/01R-18-R4%20Complaint%20Redacted.pdf,,This story about Badin gives a lot of historical context about segregation and pollution: https://undark.org/2021/12/15/the-long-legacy-of-a-company-town/,race,,01r-18-r4 complaint (pdf) (581.12 kb),epa,,,,
fy18,01x-18-r9,closed,both,"city of wilmington, ca",2018-03-12,2018-04-20,39.0,rejected 4/20/2018: lack of jurisdiction,rejected,rejected,True,Lack of jurisdiction,Trump,"Relates to a project at the Port of Los Angeles, including plans to demolish shops, offices and restaurants primarily owned by people of color",San Pedro,CA,90731,unclear,,yes,No,Coalition for a Safe Environment,,No,No,"What it outlines is more like discriminatory ""urban renewal"" causing displacement of businesses",,1.0,,https://www.epa.gov/system/files/documents/2022-09/01X-18-R9%20Correspondence%20Redacted.pdf,This was a request to multiple agencies for a criminal investigation. EPA forwarded to the Title VI office.,https://www.dailybreeze.com/2018/01/25/pain-unavoidable-for-tenants-in-ports-o-call-redevelopment-port-officials-say/,,,01x-18-r9 correspondence (pdf) (21.94 mb),epa,,,,
fy18,01x-18-r6,closed,both,texas dept. of criminal justice,2018-03-06,2018-03-13,7.0,rejected/referred to doj 3/13/2018: lack of jurisdiction,rejected and referred,rejected and referred,True,Lack of jurisdiction,Trump,"Water in one unit of the Walker County Jail is discolored and smells and is making inmates sick, while staff drink bottled water and say nothing is wrong with the tap water.",Huntsville,TX,77343,Inmates,doj ,yes,No,Redacted individual,,No,Yes,"No mention of protected class, though there likely is one; the jail probably doesn't receive EPA funding",,1.0,,https://www.epa.gov/system/files/documents/2022-09/01X-18-R6%20Complaint_Redacted.pdf,"""I am humbly asking that one or more agencies conduct an investigation into this matter and put a stop to this 8th Amendment violation.""",,,,01x-18-r6 complaint (pdf) (1.67 mb),epa,,,,
fy17,25r-17-r2,closed,both,bristol-myers squibb,2017-09-20,2017-11-13,54.0,rejected 11/13/2017: lack of jurisdiction,rejected,rejected,True,Lack of jurisdiction,Trump,None cited. A racial discrimination in employment complaint.,East Syracuse,NY,13057,Black employee,,yes,No,Redacted individual,,No,No,"Employment discrimination, not environmental discrimination",,1.0,,https://www.epa.gov/system/files/documents/2022-09/25R-17-R2%20Complaint%20Redacted.pdf,,,race,,25r-17-r2 complaint (pdf) (5.58 mb),epa,,,,
fy17,22rd-17-r3,closed,both,"city of norfolk, va",2017-08-16,2018-05-17,274.0,rejected without prejudice 5/17/2018: not ripe for investigation,rejected,rejected,True,not ripe for investigation,Trump,Plan to demolish public housing will expose people to toxic contamination as a result of prior pollution in the soil,Norfolk,VA,23510,"Not cited, but likely protected classes",,yes,No,United Front for Justice,,No,Yes,,Yes,2.0,"22rd-17-r3, 24rd-17-r3",https://www.epa.gov/system/files/documents/2022-09/23RD-17-R3%20Complaint%20%28NR%29.pdf,,,disability,,23rd-17-r3 complaint (pdf) (605.58 kb),epa,,,,
fy17,24rd-17-r3,closed,both,"norfolk redev. and housing auth., va",2017-08-16,2018-05-17,274.0,rejected without prejudice 5/17/2018: not ripe for investigation,rejected,rejected,True,not ripe for investigation,Trump,Plan to demolish public housing will expose people to toxic contamination as a result of prior pollution in the soil,Norfolk,VA,23510,"Not cited, but likely protected classes",,no,No,United Front for Justice,,No,Yes,,Yes,2.0,"22rd-17-r3, 24rd-17-r3",https://www.epa.gov/system/files/documents/2022-09/24RD-17-R3%20Complaint%20%28NR%29.pdf,,,disability,,24rd-17-r3 complaint (pdf) (605.58 kb),epa,,,,
fy17,21x-17-r9,closed,both,"redlands, ca resident",2017-07-25,2017-07-31,6.0,rejected/closed 7/31/2017: no discrimination alleged,rejected,rejected,True,no discrimination alleged,Trump,"Consumer's sparkplugs turned a red-orange color after using Arco gasoline. (This was not filed as a Title VI complaint; it was addressed, ""Attn: Consumer Complaints."")",Redlands,CA,92373,,,yes,No,Redacted individual,,No,No,It's a consumer complaint and wasn't even intended to go to the Title VI office,,1.0,,https://www.epa.gov/system/files/documents/2022-09/21X-17-R9%20Complaint_Redacted.pdf,,,,,21x-17-r9 complaint (pdf) (1.49 mb),epa,,,,
fy17,22d-17-r3,closed,both,"franklin township, butler county, pa",2017-07-11,2017-09-08,59.0,rejected 9/8/2017: lack of jurisdiction,rejected,rejected,True,Lack of jurisdiction,Trump,"Town changed ordinances to allow fracking ""with no regard to my complaints on health requirements"" to protect people who are disabled, elderly or ill.",Franklin Township,PA,not disclosed,"People with disabilities, elderly or ill people",,yes,No,Redacted individual,,No,Yes,,,1.0,,https://www.epa.gov/system/files/documents/2022-09/22D-17-R3%20Complaint%20Redacted.pdf,,,disability,,22d-17-r3 complaint (pdf) (311.95 kb),epa,,,,
fy17,20s-17-r10,closed,both,marketeering group,2017-06-03,2017-06-08,5.0,rejected/closed 6/8/2017: lack of jurisdiction,rejected,rejected,True,Lack of jurisdiction,Trump,"None cited, though most of the complaint is redacted. It's an employment discrimination complaint.",Not disclosed,Not disclosed,Not disclosed,Not disclosed,,yes,No,Redacted individual,,No,No,"Employment discrimination, not environmental discrimination",,1.0,,https://www.epa.gov/system/files/documents/2022-09/20X-17-R10%20Complaint%20Redacted.pdf,,,,,20s-17-r10 complaint (pdf) (367.42 kb),epa,,,,
fy17,19x-17-r7,closed,both,miller county health dept. (mo),2017-05-16,2017-06-19,34.0,rejected 6/19/2017: lack of jurisdiction – no discrimination alleged,rejected,rejected,True,"Lack of jurisdiction, no discrimination alleged",Trump,Neighbor's malfuctioning septic tank is contaminating complainants' property and endangering their health; county actions haven't resolved the problem.,Not disclosed,MO,Not disclosed,Immune-compromised individuals,,yes,No,Redacted individuals,,No,No,"An environmental issue, but one caused by a neighbor's inability to maintain their septic tank; no discrimination cited",,1.0,,https://www.epa.gov/system/files/documents/2022-09/19X-17-R7%20Complaint%20Redacted.pdf,,,,,19x-17-r7 complaint (pdf) (296.89 kb),epa,,,,
fy17,18x-17-r5,closed,both,"village of barrington, il",2017-05-10,2017-09-14,127.0,rejected 9/14/2017: lack of jurisdiction – no discrimination alleged,rejected,rejected,True,"Lack of jurisdiction, no discrimination alleged",Trump,"Raw sewage is coming out of manholes in parts of the village, while the village updates sewage drains in unaffected areas with EPA funding",Barrington,IL,60010,Not cited beyond geography,,yes,No,Redacted individual,,No,Unlikely,No protected class mentioned,,1.0,,https://www.epa.gov/system/files/documents/2022-09/18X-17-R5%20Complaint_Redacted.pdf,,,,,18x-17-r5 complaint (pdf) (366.34 kb),epa,,,,
fy17,17x-17-r4,closed,both,"franklin correctional inst., nc",2017-05-01,2017-08-11,102.0,rejected 8/11/2017: lack of jurisdiction,rejected,rejected,True,Lack of jurisdiction,Trump,"Inmate's health is deteriorating, and they suspect the cause is the asbestos they were exposed to as a youth working an after-school job where asbestos removal happened while they were on site. They're asking for help.",Bunn,NC,27508 ,"Inmate is the complainant, but is asking for help related to health impacts from an occupational exposure as a youth",,yes,No,Redacted individual,,No,No,An occupational exposure situation (before the complainant was imprisoned),,1.0,,https://www.epa.gov/system/files/documents/2022-09/17X-17-R4%20Complaint_Redacted.pdf,,,,,17x-17-r4 complaint (pdf) (374.92 kb),epa,,,,
fy17,16r-17-r4,closed,both,alabama dept. of envir. mgmt. (stone's throw landfill),2017-04-28,2018-12-10,591.0,resolved 12/10/2018: preliminary findings of insufficient evidence of discrimination,resolved,resolved: insufficient evidence,False,,Trump,"Permit renewal of Stone’s Throw Landfill did not ""evaluate whether the permit had an unjustified disparate impact"" as federal law requires. ""ADEM’s failure and disregard for the mandates of Title VI and EPA’s regulations is all the more egregious given that ADEM is currently the subject of a civil rights complaint because of the adverse disparate impacts of this very facility.""",Tallassee,AL,36078,Black community,,yes,Yes,Environmental Justice Clinic Yale Law School; NAACP Legal Defense & Educational Fund; Earthjustice,Ashurst Bar/Smith Community Organization,No,Yes,,,1.0,,https://www.epa.gov/system/files/documents/2022-09/16R-17-R4%20Complaint%20%28NR%29.pdf,"""This permit was granted with a deficient method of administration that subjects Black residents of the Ashurst Bar/Smith community to racially disparate harms. These allegations are supported by data about the siting of landfills in Tallapoosa County, numerous declarations from community members, and ADEM and TCC’s failure to ever conduct even a basic disparate impact assessment for the Landfill. On these bases, we respectfully ask EPA to make a finding of discrimination. If EPA believes that there are gaps in the administrative record that preclude a conclusive finding, we respectfully ask EPA to continue its investigation and provide ABSCO with a meaningful opportunity to present further evidence so that EPA can reach a fully informed decision. """,,race,,16r-17-r4 complaint (pdf) (155.19 kb),epa,,,,
fy17,15x-17-r7,closed,both,"city of merriam, ks",2017-04-11,2017-04-12,1.0,rejected and referred 4/12/2017: lack of jurisdiction,rejected and referred,rejected and referred,True,Lack of jurisdiction,Trump,Complaint about paint products in a company operating in violation of zoning,Merriam,KS,66203,Not disclosed,,yes,No,Redacted individual,,No,No,No discrimination or protected class mentioned,,1.0,,https://www.epa.gov/system/files/documents/2022-09/15X-17-R7%20Complaint_Redacted.pdf,,,,,15x-17-r7 complaint (pdf) (476.46 kb),epa,,,,
fy17,13r-17-r9,closed,both,"city of oakland, ca & board of port commissioners",2017-04-05,2019-12-19,988.0,resolved through informal resolution agreement 7/25/2019; monitoring completed and case closed 12/19/2019,resolved,resolved: informal resolution agreement,False,,Trump,"Port of Oakland expansions expose directly impacted West Oakland residents, nearly 80 percent of whom are people of color, to ""severe air pollution emissions without adequate mitigation.""",Oakland,CA,multiple,Predominantly Black and Latino community,,yes,Yes,Earthjustice,West Oakland Environmental Indicators Project ,No,Yes,,Yes,2.0,"13r-17-r9, 14r-17-r9",https://www.epa.gov/system/files/documents/2022-09/13R-17-R9%20Complaint%20%28NR%29.pdf,,,race, national origin,13r-17-r9 complaint (pdf) (1.75 mb),epa,,,,
fy17,14r-17-r9,closed,both,port of oakland & board of port commissioners,2017-04-05,2019-11-27,966.0,resolved through informal resolution agreement 7/25/2019; monitoring completed and case closed 11/27/2019,resolved,resolved: informal resolution agreement,False,,Trump,"Port of Oakland expansions expose directly impacted West Oakland residents, nearly 80 percent of whom are people of color, to ""severe air pollution emissions without adequate mitigation.""",Oakland,CA,multiple,Predominantly Black and Latino community,,no,Yes,Earthjustice,West Oakland Environmental Indicators Project ,No,Yes,,Yes,2.0,"13r-17-r9, 14r-17-r9",https://www.epa.gov/system/files/documents/2022-09/14R-17-R9%20Complaint%20%28NR%29.pdf,,,race,,14r-17-r9 complaint (pdf) (1.75 mb),epa,,,,
fy17,11d-17-r7,closed,both,"city of merriam, ks",2017-03-31,2017-11-24,238.0,rejected 11/24/2017: lack of jurisdiction,rejected,rejected,True,Lack of jurisdiction,Trump,"City doesn't ban leaf burning; complainant is a disabled Vietnam veteran who writes that this situation means suffering with ""discrimination and health problems""",Merriam,KS,66203,Person with disabilities,,yes,No,Redacted individual,,No,Unlikely,"It's an environmental issue (pollution from burning leaves), but it doesn't seem to be describing a situation where the impact discriminates against a protected class",Yes,2.0,"11d-17-r7, 12d-17-r7",https://www.epa.gov/system/files/documents/2022-09/11D-17-R7%20Complaint_Redacted.pdf,,,disability,,11d-17-r7 complaint (pdf) (554.28 kb),epa,,,,
fy17,12d-17-r7,closed,both,"city of overland park fire dept., ks",2017-03-31,2017-11-24,238.0,rejected 11/24/2017: lack of jurisdiction,rejected,rejected,True,Lack of jurisdiction,Trump,"City doesn't ban leaf burning; complainant is a disabled Vietnam veteran who writes that this situation means suffering with ""discrimination and health problems""",Merriam,KS,66203,Person with disabilities,,no,No,Redacted individual,,No,Unlikely,"It's an environmental issue (pollution from burning leaves), but it doesn't seem to be describing a situation where the impact discriminates against a protected class",Yes,2.0,"11d-17-r7, 12d-17-r7",https://www.epa.gov/system/files/documents/2022-09/12D-17-R7%20Complaint_Redacted.pdf,,,disability,,12d-17-r7 complaint (pdf) (553.7 kb),epa,,,,
fy17,10d-17-r4,closed,both,"city of tallahassee, fl",2017-02-07,2018-03-01,387.0,rejected 3/1/2018: lack of jurisdiction,rejected,rejected,True,Lack of jurisdiction,Trump,"DOJ referred the complaint, which is about contaminated drinking water (discolored, with ""bacteria, high iron and High chlorine""). ""I am disabled & brown water issues are causing more health issues.""",Tallahassee,FL,32303,Person with disabilities,,yes,No,Redacted individual,,No,Yes,,,1.0,,https://www.epa.gov/system/files/documents/2022-09/10D-17-R4%20Complaint_Redacted.pdf,,,disability,,10d-17-r4 complaint (pdf) (370.92 kb),epa,,,,
fy17,09d-17-r9,closed,both,"city of south lake tahoe, ca",2017-02-06,2023-06-13,2318.0,rejected 12/27/2018: allegation not grounded in fact/not appropriate for investigation/untimely,rejected,rejected,True,"allegation not grounded in fact, not appropriate for investigation, untimely",Trump,"DOJ referred the complaint, which is about air toxics from an asphalt plant. ""People with immune system disabilities are much more vulnerable"" to these types of toxics, but the city has no provisions to protect complainant and others in that situation.",South Lake Tahoe,CA,96150,Person with disabilities,,yes,No,Redacted individual,,No,Yes,,,1.0,,https://www.epa.gov/system/files/documents/2022-09/09D-17-R9%20Complaint_Redacted.pdf,"Note: The start of the document shows another complaint, but scroll down for this one. On page 6 of the document, there's a question about efforts to resolve the complaint through internal grievance procedures and asks about the status. Answer: ""All sources claim 'no jurisdiction.'"" Later notes, ""There are no public entities that claim they can help disabled persons like me, who have unique vulnerabilities and are severely sensitive to airborne toxins. ... Six neighbors have died from cancer with no investigations.""",,disability,,09d-17-r9 complaint (pdf) (696.17 kb),epa,,,,
fy17,07r-17-r7,closed,both,missouri dnr,2016-12-27,2018-07-13,563.0,rejected 7/13/2018: untimely filed,rejected,rejected,True,untimely,Trump,"DOJ referred the complaint; city of Grandview, ""an environmental justice community,"" expressed environmental justice concerns about the state DNR's process for issuing a permit to Ideker in 2012 for an asphalt plant and effectively denied the city and its citizens opportunities for input",Grandview,MO,multiple,Predominantly Black and Latino residents,,yes,Yes,City of Grandview,,No,Yes,,Yes,2.0,"07r-17-r7, 08r-17-r7",https://www.epa.gov/system/files/documents/2022-09/07R-17-R7%20Complaint%20%28NR%29.pdf,,,race,,07r-17-r7 complaint (pdf) (516.22 kb),epa,,,,
fy17,08r-17-r7,closed,both,"kansas city, mo health dept.",2016-12-26,2017-08-14,231.0,administratively closed 8/14/2017: complainant withdrew complaint,rejected,closed: complaint withdrawn,False,,Trump,"DOJ referred the complaint; city of Grandview, ""an environmental justice community,"" expressed environmental justice concerns about the state DNR's process for issuing a permit to Ideker in 2012 for an asphalt plant and effectively denied the city and its citizens opportunities for input",Grandview,MO,multiple,Predominantly Black and Latino residents,,no,Yes,City of Grandview,,No,Yes,,Yes,2.0,"07r-17-r7, 08r-17-r7",https://www.epa.gov/system/files/documents/2022-09/08R-17-R7%20Complaint%20%28NR%29.pdf,,,race,,08r-17-r7 complaint (pdf) (516.22 kb),epa,,,,
fy17,06x-17-r5,closed,both,wisconsin dept. of corrections,2016-11-30,2017-08-03,246.0,rejected and referred to doj 8/3/2017: lack of jurisdiction,rejected and referred,rejected and referred,True,Lack of jurisdiction,Trump,Black mold in the showers located in cells is damaging the complainant's lungs. Flooding is also a problem and the drinking water seems contaminated; some prisoners were sickened. Complainant is concerned inmates will die.,Boscobel,WI,53805,Inmates,doj ,yes,No,Redacted individual,,No,Yes,"No mention of protected class, though there likely is one; the jail probably doesn't receive EPA funding",,1.0,,https://www.epa.gov/system/files/documents/2022-09/06X-17-R5%20Complaint_Redacted.pdf,"""I am a guy that's not ready for the WDOC to take my life and claim natural causes as I've known for them to do. ... They are violating my civil and federal rights to clean air, and to clean water. If you check, you'll see for yourself.""",,,,06x-17-r5 complaint (pdf) (1.15 mb),epa,,,,
fy17,03d-17-r4,closed,both,kentucky energy & envir. cabinet,2016-11-29,2023-06-13,2387.0,rejected 9/15/2017: allegation not grounded in fact/not appropriate for investigation,rejected,rejected,True,"allegation not grounded in fact, not appropriate for investigation",Trump,DOJ referred the complaint; the complainant had complained to the state EPA about fumes from a car-painting facility 20 feet from their house and was upset with how the agency handled it.,Barbourville,KY,40906,Person with disabilities,,yes,No,Redacted individual,,No,Possibly,,,1.0,,https://www.epa.gov/system/files/documents/2022-09/03D-17-R4%20Complaint%20Email_Redacted.pdf,This attachment has the meat of the complaint: https://www.epa.gov/system/files/documents/2022-09/03D-17-R4%20DOJ%20Complaint_Redacted_0.pdf. This is an internal email from a state employee about the matter: https://www.epa.gov/system/files/documents/2022-09/03D-17-R4%20Compl%20Attach1_Redacted.pdf,,disability,,03d-17-r4 complaint email (pdf) (53.53 kb) 03d-17-r4 doj complaint (pdf) (609.86 kb) 03d-17-r4 complaint attach1 (pdf) (4.98 mb) 03d-17-r4 complaint attach2 (pdf) (165.3 kb) 03d-17-r4 complaint attach3 (pdf) (7.95 mb),epa,,,,
fy17,04d-17-r9,closed,both,"avalonbay communities, inc.",2016-11-29,2017-11-03,339.0,rejected 11/3/2017: lack of jurisdiction,rejected,rejected,True,Lack of jurisdiction,Trump,"DOJ referred the complaint; the disabled complainant is chemically sensitive and cannot be exposed to pesticides, which the apartment complex is using",West Hills,CA,91308,Person with disabilities,,yes,No,Redacted individual,,No,Possibly,"Unlikely the apartment complex receives EPA funding, though",Yes,2.0,"04d-17-r9, 05d-17-r9",https://www.epa.gov/system/files/documents/2022-09/04D-17-R9%20Complaint_Redacted.pdf,,,disability,,04d-17-r9 complaint (pdf) (1.61 mb),epa,,,,
fy17,05d-17-r9,closed,both,oakwood worldwide,2016-11-29,2017-11-03,339.0,rejected 11/3/2017: lack of jurisdiction,rejected,rejected,True,Lack of jurisdiction,Trump,"DOJ referred the complaint; the disabled complainant is chemically sensitive and cannot be exposed to pesticides, which the apartment complex is using",West Hills,CA,91308,Person with disabilities,,no,No,Redacted individual,,No,Possibly,"Unlikely the apartment complex receives EPA funding, though",Yes,2.0,"04d-17-r9, 05d-17-r9",https://www.epa.gov/system/files/documents/2022-09/05D-17-R9%20Complaint_Redacted.pdf,,,disability,,05d-17-r9 complaint (pdf) (1.61 mb),epa,,,,
fy17,02r-17-r9,closed,both,calif. air resources board,2016-11-14,2016-12-05,21.0,administratively closed 12/5/2016: complainant withdrew complaint,rejected,closed: complaint withdrawn,False,,Obama,"The California Air Resources Board’s Cap and Trade program ""violates Title VI of the Civil Rights Act by denying Californian of color living near Cap and Trade facilities the benefits of direct emissions reductions,"" resulting in ""racially disparate impact based on the demographic composition of communities near Cap and Trade facilities compared to the unaffected population.""",multiple,CA,multiple,People of color,,yes,Yes,Coalition for a Safe Environment; Association of Irritated Residents; California Communities Against Toxics; Society for Positive Action; West County Toxics Coalition,,No,Yes,,,1.0,,https://www.epa.gov/system/files/documents/2022-09/02R-17-R9%20Complaint%20with%20Exhibits%20%28NR%29.pdf,"""Complainants respectfully request that OCR (1) articulate a standard for ripeness that will inform the public when a complainant should file a Title VI complaint; and (2) accept this Complaint for investigation. Even if OCR finds that this complaint is still not ripe for review, then OCR should nevertheless accept the complaint for investigation and hold the complaint in abeyance pending the action OCR deems necessary for ripeness.""",,race,,02r-17-r9 complaint (pdf) (25.28 mb),epa,,,,
fy17,01r-17-r5,closed,both,illinois epa,2016-11-02,2017-11-24,387.0,rejected 11/24/2017: lack of jurisdiction; untimely filed,rejected,rejected,True,"Lack of jurisdiction, untimely",Trump,"Referred by the White House, to which the complainant wrote asking for help, saying a state EPA inspector was targeting his medical waste treatment business and ""spoke personal racial attacks against me and my staff.""",Rockford,IL,61101,Not disclosed,,yes,No,Redacted individual,,No,No,Not about pollution or other environmental exposure,,1.0,,https://www.epa.gov/system/files/documents/2022-09/01R-17-R5%20WHCorrespondence2_Redacted.pdf,Attached: https://www.epa.gov/system/files/documents/2022-09/01R-17-R5%20WHCorrespondence1_Redacted.pdf,,race,,01r-17-r5 complaint (pdf) (657.7 kb) 01r-17-r5 wh corr 1 (pdf) (237.5 kb) 01r-17-r5 wh corr 2 (pdf) (9.55 kb),epa,,,,
fy16,48x-16-r6,closed,both,lewis unit (tx),2016-09-23,2016-12-19,87.0,resolved and closed administratively 12/19/2016: provided epa contact re: injection of flotation foam for boats,resolved,closed: not a complaint,False,"N/A; not actually a Title VI complaint, just a request for information",,Entrepreneur asks EPA generally (not Title VI office specifically) about hazards of floatation foam for boat manufacturing,Woodville,TX,not disclosed,Potential business owner,,,No,Redacted individual,,No,No,"Not a complaint, just a request for information",,1.0,,https://www.epa.gov/system/files/documents/2022-09/48X-16-R6%20Complaint%20Redacted.pdf,,,,,48x-16-r6 complaint (pdf) (409.36 kb),epa,,,,
