fy_rec'd,epa_file_#,summary_status,_merge,named_entity,clean_date_received,recent_status_date,time_difference,detailed_status,primary_status_map,simplified_status,compare_statuses,reason_for_rejection_if_applicable,presidential_administration,environmental_justice_issue_cited,city,state,zip_code,community_impacted,referred_agency,is_unique,filed_by_a_lawyer,group_filing,filed_on_behalf_of,epa_initiated_compliance_review,complaint_about_environmental_justice_matter,notes_on_ej_categorization,more_than_one_complaint,total_related_complaints,related_complaint_numbers,complaint_link,notes,additional_notes,disc_basis_1,disc_basis_2,related_documents,origin,final_adjudication_&_reason,disc_basis_3,disc_basis_4,disc_basis_5
fy22,01r-22-r4,closed,both,"city of conyers, ga",2021-10-14,2022-07-06,265.0,rejected/referred to hud 7/6/2022: lack of jurisdiction,rejected and referred,rejected and referred,True,Lack of jurisdiction,Biden,"Annexation and rezoning actions ""are discriminatory and have disenfranchised our community. ... Given the pending developments in the City of Conyers and Rockdale County, this problem can only become more acute in generating more flooding in yards, pollution discharge in water systems and soil erosion.""",Conyers,GA,30094,Primarily Black and people of color,hud ,no,No,Nob Hill Homeowners Association,,No,Yes,,Yes,3.0,"03r-22-r4, 01r-22-r4, 02r-22-r4",https://www.epa.gov/system/files/documents/2022-04/01r-21-r4-complaint_redacted.pdf,,,race,,01r-22-r4 complaint (pdf) (210.6 kb) 01r-22-r4 rec reject-referral (pdf) (125.19 kb) 01r-22-r4 reject-referral hud (pdf) (102.72 kb),epa,,,,
fy22,02r-22-r4,active,both,"rockdale county, ga",2021-10-14,2023-06-13,607.0,pending: in informal resolution agreement negotiation,pending,pending: in informal resolution agreement negotiation,False,,Biden,City of Conyers and Rockdale County annexed and rezoned parcels for an apartment complex beside an area already suffering from flooding,Conyers,GA,30094,Primarily Black and people of color,,yes,No,Nob Hill Homeowners Association,,No,Yes,,Yes,3.0,"03r-22-r4, 01r-22-r4, 02r-22-r4",https://www.epa.gov/system/files/documents/2022-04/2021-10-14_complaint_3.pdf,,,race,,02r-22-r4 complaint (pdf) (210.6 kb) 02r-22-r4 acceptance rec (pdf) (125.1 kb) 02r-22-r4 rec tolling ltr (pdf) (228.11 kb),epa,,,,
fy21,05rno-21-r4,active,both,north carolina dept. of envir. quality,2021-09-27,2023-06-13,624.0,pending: in informal resolution agreement negotiation,pending,pending: in informal resolution agreement negotiation,False,,Biden,"State issued permits authorizing swine waste management systems ""that lack necessary protections against air and water pollution at four industrial hog operations""",Duplin and Sampson counties,NC,multiple,Primarily Black and Latino,,yes,Yes,Southern Environmental Law Center,Duplin County Branch of the North Carolina Conference of the National Association for the Advancement of Colored People; the North Carolina Poor People’s Campaign,No,Yes,,,1.0,,https://www.epa.gov/system/files/documents/2022-06/05RNO-21-R4%20Complaint_Redacted.pdf,Unredacted complaint: https://www.southernenvironment.org/wp-content/uploads/2021/09/2021-09-27-Title-VI-Complaint-Index-DEQ-Biogas-Permits.pdf,,race, national origin,05rno-21-r4 complaint (pdf) (761.71 kb) 05rno-21-r4 complaint supplement (pdf) (493.84 kb),epa,,,,
fy21,03no-21-r6,active,both,new mexico envir. dept.,2021-09-16,2023-06-13,635.0,pending: in informal resolution agreement negotiation,pending,pending: in informal resolution agreement negotiation,False,,Biden,"State discriminated against complainant during a virtual public hearing regarding the construction of an asphalt plant ""when I was denied a Spanish interpreter and discriminated against due to my nationality and my limited fluency in English. ... the ashalt plant construction directly affects the community of southern Santa Fe, where most have Spanish as their native language and many do not have advanced knowledge of the English language, let alone a level of English that would allow the understanding or handling of the technical jargon used in this hearing.""",Santa Fe,NM,Multiple (site: 87507),Spanish speakers,,yes,"Unclear (looks like environmental groups helped, so probably)",Redacted individual,,No,Yes,,,1.0,,https://www.epa.gov/system/files/documents/2022-06/03NO-21-R6%20Complaint%20_Redacted.pdf,"New Mexico Environmental Law Center and Earth Care New Mexico are involved, according to this story: https://finance.yahoo.com/news/group-claims-discrimination-over-hearing-040100201.html?guccounter=1",,national origin,,03no-21-r6 complaint (pdf) (54.11 kb),epa,,,,
fy21,03r-21-r5,closed,both,kalamazoo county,2021-09-01,2021-11-24,84.0,rejected 11/24/2021: untimely filed,rejected,rejected,True,untimely,Biden,"County of Kalamazoo and EGLE of Michigan discriminating by allowing expansion by ""a polluter known to be out of compliance for toxic releases into the air and water,"" and EGLE found ""Graphic Packaging operating without an air permit but did not shut them down""",Kalamazoo,MI,"not mentioned (""Northside of Kalamazoo"")",Primarily Black residents,,no,No,Redacted individual,,No,Yes,,Yes,2.0,"03r-21-r5, 04r-21-r5",https://www.epa.gov/system/files/documents/2022-06/03R-21-R5%20Complaint_Redacted.pdf,"EPA split this into two because the county portion was untimely, but not the state portion",,race,,03r-21-r5 complaint (pdf) (61.92 kb),epa,,,,
fy21,04r-21-r5,active,both,michigan egle (kalamazoo),2021-09-01,2023-06-13,650.0,pending: in informal resolution agreement negotiation,pending,pending: in informal resolution agreement negotiation,False,,Biden,"County of Kalamazoo and EGLE of Michigan discriminating by allowing expansion by ""a polluter known to be out of compliance for toxic releases into the air and water,"" and EGLE found ""Graphic Packaging operating without an air permit but did not shut them down""",Kalamazoo,MI,"not mentioned (""Northside of Kalamazoo"")",Primarily Black residents,,yes,No,Redacted individual,,No,Yes,,Yes,2.0,"03r-21-r5, 04r-21-r5",https://www.epa.gov/system/files/documents/2022-06/03R-21-R5%20Complaint_Redacted.pdf,"EPA split this into two because the county portion was untimely, but not the state portion",,race,,04r-21-r5 complaint (pdf) (61.92 kb),epa,,,,
fy21,02rno-21-r2,active,both,new york state dept. of envir. conservation,2021-08-30,2023-06-13,652.0,pending: in informal resolution agreement negotiation,pending,pending: in informal resolution agreement negotiation,False,,Biden,"The DEC, NY State Department of Public Service and National Grid discriminated regarding a proposed gas pipeline. (DEC, for instance, did an environmental analysis for one part of a proposed gas pipeline affecting white communities and found no environmental impact, ""but illegally segmented and failed to review the pipeline that ran through Black and Brown communities."")",Brooklyn,NY,multiple,Predominantly Black and Latino residents,,yes,Yes,National Center for Law and Economic Justice; the New York Law School Civil Rights and Disability Justice Clinic,Brownsville Green Justice; the Ocean Hill-Brownsville Coalition of Young Professionals; Mi Casa Resiste; the Indigenous Kinship Collective,No,Yes,,Yes,3.0,"02rno-21-r2, 03rno-21-r2, 04rno-21-r2",https://www.epa.gov/system/files/documents/2022-06/02RNO-21-R2%20Complaint_Redacted.pdf,Unredacted complaint: https://nclej.org/wp-content/uploads/2021/08/brownsville-green-justice-title-vi-complaint.pdf. Press release: https://nclej.org/news/complaint-against-national-grid-nys-brownsville-pipeline,,race, national origin,02rno-21-r2 complaint (pdf) (15.51 mb),epa,,,,
fy21,03rno-21-r2,closed,both,new york dept. of public service,2021-08-30,2021-10-21,52.0,"not accepted for investigation 10/21/2021: lack of jurisdiction (accepted by dot; dot, epa, dec and dps are coordinating on informal resolution agreement negotiation",rejected,rejected,True,"Lack of jurisdiction, pending other agency investigation",Biden,"The DEC, NY State Department of Public Service and National Grid discriminated regarding a proposed gas pipeline. ",Brooklyn,NY,multiple,Predominantly Black and Latino residents,,no,Yes,National Center for Law and Economic Justice; the New York Law School Civil Rights and Disability Justice Clinic,Brownsville Green Justice; the Ocean Hill-Brownsville Coalition of Young Professionals; Mi Casa Resiste; the Indigenous Kinship Collective,No,Yes,,Yes,3.0,"02rno-21-r2, 03rno-21-r2, 04rno-21-r2",https://www.epa.gov/system/files/documents/2022-06/02RNO-21-R2%20Complaint_Redacted.pdf,Unredacted complaint: https://nclej.org/wp-content/uploads/2021/08/brownsville-green-justice-title-vi-complaint.pdf. Press release: https://nclej.org/news/complaint-against-national-grid-nys-brownsville-pipeline,,race, national origin,03rno-21-r2 complaint (pdf) (15.51 mb),epa,,,,
fy21,04rno-21-r2,closed,both,national grid,2021-08-30,2021-10-21,52.0,"not accepted for investigation 10/21/2021: lack of jurisdiction (coordinating with doj, dot, doe)",rejected,rejected,True,"Lack of jurisdiction, coordinating with other agencies",Biden,"The DEC, NY State Department of Public Service and National Grid discriminated regarding a proposed gas pipeline. ",Brooklyn,NY,multiple,Predominantly Black and Latino residents,,no,Yes,National Center for Law and Economic Justice; the New York Law School Civil Rights and Disability Justice Clinic,Brownsville Green Justice; the Ocean Hill-Brownsville Coalition of Young Professionals; Mi Casa Resiste; the Indigenous Kinship Collective,No,Yes,,Yes,3.0,"02rno-21-r2, 03rno-21-r2, 04rno-21-r2",https://www.epa.gov/system/files/documents/2022-06/02RNO-21-R2%20Complaint_Redacted.pdf,Unredacted complaint: https://nclej.org/wp-content/uploads/2021/08/brownsville-green-justice-title-vi-complaint.pdf. Press release: https://nclej.org/news/complaint-against-national-grid-nys-brownsville-pipeline,,race, national origin,04rno-21-r2 complaint (pdf) (15.51 mb),epa,,,,
fy21,02r-21-r6,active,both,texas comm. on envir. quality,2021-08-18,2023-06-13,664.0,pending: in informal resolution agreement negotiation,pending,pending: in informal resolution agreement negotiation,False,,Biden,"TCEQ's renewal of an operating permit for Oxbow’s calcined coke facility in Port Arthur, without Best Available Control Technologies and effective compliance plan; the site is one of the highest emitters of sulfur dioxide in Texas and is beside the West Port Arthur neighborhood",Port Arthur,TX,"not mentioned (""West Port Arthur"")",Primarily Black residents,,yes,Yes,Lone Star Legal Aid; Environmental Integrity Project,Port Arthur Community Action Network,No,Yes,,,1.0,,https://www.epa.gov/system/files/documents/2022-06/02R-21-R6%20Complaint_Redacted.pdf,Unredacted complaint: https://environmentalintegrity.org/wp-content/uploads/2021/08/2021.08.18_Oxbow-Title-VI-Complaint-Final.pdf. Press release: https://environmentalintegrity.org/news/groups-demand-epa-investigate-texas-industrial-plant-for-civil-rights-violations. Grist had a big investigation on this plant recently: https://grist.org/project/accountability/koch-oxbow-port-arthur-texas-clean-air-act-pollution/,,race,,02r-21-r6 complaint (pdf) (4.27 mb),epa,,,,
fy21,03r-21-r3,active,both,virginia dept. of envir. quality,2021-07-21,2023-06-13,692.0,pending: in informal resolution agreement negotiation,pending,pending: in informal resolution agreement negotiation,False,,Biden,"Ignoring impact from a proposed Wegmans Distribution Center on a community formed by formerly enslaved people, already disproportionately impacted by pollution; also, the earlier rezoning occurred during a stay-at-home order amid the pandemic and the community was unable to participate in the hearing ",Ashland (Brown Grove),VA,23005,Primarily Black residents,,yes,No,Redacted individual,,No,Yes,,Yes,2.0,"03r-21-r3, 04r-21-r3",https://www.epa.gov/system/files/documents/2022-06/03R-21-R3%20Complaint_Redacted.pdf,"From the complaint: ""Brown Grove was established by freed people after the Civil War and has suffered from over 60+ years of government sponsored discrimination since the construction of Interstate 95 split the community in half. With 2 interchanges to the interstate, much of the industrial development in Hanover County has been focused on this community."" A news story: https://www.bayjournal.com/news/growth_conservation/wegmans-site-under-construction-in-brown-grove-va/article_2352ed56-dac8-11ec-bd9f-1fb4d9f7bbfe.html",,race,,03r-21-r3 complaint (pdf) (67.38 kb) 03r-21-r3 complaint attachment (pdf) (225.37 kb),epa,,,,
fy21,04r-21-r3,closed,both,"hanover county, va",2021-07-21,2021-08-12,22.0,rejected 8/12/2021: lack of jurisdiction,rejected,rejected,True,Lack of jurisdiction,Biden,"Ignoring impact from a proposed Wegmans Distribution Center on a community formed by formerly enslaved people, already disproportionately impacted by pollution; also, the earlier rezoning occurred during a stay-at-home order amid the pandemic and the community was unable to participate in the hearing ",Ashland (Brown Grove),VA,23005,Primarily Black residents,,no,No,Redacted individual,,No,Yes,,Yes,2.0,"03r-21-r3, 04r-21-r3",https://www.epa.gov/system/files/documents/2022-06/03R-21-R3%20Complaint_Redacted.pdf,"From the complaint: ""Brown Grove was established by freed people after the Civil War and has suffered from over 60+ years of government sponsored discrimination since the construction of Interstate 95 split the community in half. With 2 interchanges to the interstate, much of the industrial development in Hanover County has been focused on this community."" A news story: https://www.bayjournal.com/news/growth_conservation/wegmans-site-under-construction-in-brown-grove-va/article_2352ed56-dac8-11ec-bd9f-1fb4d9f7bbfe.html",,race,,04r-21-r3 complaint (pdf) (67.38 kb) 04r-21-r3 complaint attachment (pdf) (225.37 kb),epa,,,,
fy21,01ds-21-r2,closed,both,"borough of sayreville, nj",2021-06-29,2021-07-23,24.0,rejected 7/23/2021: lack of jurisdiction,rejected,rejected,True,Lack of jurisdiction,Biden,Situation redacted,Sayreville,NJ,not mentioned,"""Family status"" and ""sex"" were listed as personal characteristics relevant to the complaint",,yes,No,Redacted individual,,No,Unclear,Largely redacted,,1.0,,https://www.epa.gov/system/files/documents/2022-06/01X-21-R2%20Complaint_Redacted.pdf,Pretty much entirely redacted,,disability, sex,01x-21-r2 complaint (pdf) (174.81 kb),epa,,,,
fy21,02d-21-r3,closed,both,maryland dept. of environment,2021-06-01,2023-06-13,742.0,rejected 7/28/2021: untimely filed/same complaint pending with eeoc,rejected,rejected,True,"untimely, pending with other agency",Biden,Situation redacted,Randallstown,MD,21133,A person with disabilities,,yes,No,Redacted individual,,No,Unlikely,Looks like an employment situation involving an environmental agency,,1.0,,https://www.epa.gov/system/files/documents/2022-06/02D-21-R3%20Complaint_Redacted.pdf,,,disability, employment,02d-21-r3 complaint (pdf) (64.09 kb),epa,,,,
fy21,01rno-21-r6,closed,both,texas dept. of transportation,2021-05-28,2021-06-24,27.0,"rejected 6/24/2021: same complaint pending with lead agency, u.s. dot",rejected,rejected,True,pending with another agency,Biden,North Houston Highway Improvement Project's displacement and pollution will disproportionately impact people of color ,Houston,TX,multiple,Residents of color,,yes,Yes,"Air Alliance Houston; LINK Houston; Stop TxDOT I-45; Texas Housers; Coalition for Environment, Equity and Resilience; National Black Environmental Justice Network; Environment Texas; Environmental Integrity Project; Texas Campaign for the Environment; Greater Houston Coalition for Justice; Texas Appleseed; Coalition of Community Organizations; One Breath Partnership",,No,Yes,,,1.0,,https://www.epa.gov/system/files/documents/2022-06/01RNO-21-R6%20Complaint_Redacted.pdf,"""On February 22, 2021, the Federal Highway Administration informed us that our letter to the Texas DOT was being treated as a Title VI complaint and had been assigned to that agency’s Office of Civil Rights. ... We request that EPA carefully exercise its authorities and responsibilities relating to these issues raised by the NHHIP, with a focus on assuring not only that the minimum substantive and procedural requirements of federal law are complied with, but also ensuring, in coordination with the Civil Rights Office of the Federal Highway Administration, that the Project’s deficiencies from an environmental justice perspective and TxDOT’s noncompliance with Title VI be fully investigated and satisfactorily corrected and mitigated."" But the agency declined to investigate because FHA already is.",,race, national origin,01rno-21-r6 complaint (pdf) (131.35 kb) 01rno-21-r6 reject rec (pdf) (110.6 kb),epa,,,,
fy21,02r-21-r5,active,both,upper miss. river basin association,2021-05-28,2023-06-13,746.0,pending: in informal resolution agreement negotiation,pending,pending: in informal resolution agreement negotiation,False,,Biden,"Association is ""knowingly and deliberately excluding people of color living in the Mississippi River floodplain areas from participating in the development of programs, projects and policies related to flooding along the Mississippi River.""",Upper Mississippi River Basin region,Multiple,multiple,Residents of color,,yes,No,Redacted individual,,No,Yes,,,1.0,,https://www.epa.gov/system/files/documents/2022-06/02R-21-R5%20Complaint_Redacted.pdf,"Complainant is from East Moline, IL 61244. Quote from complaint: ""There are many studies that show flooding disproportionately impacts communities of color. Therefore, it is inappropriate for UMRBA to conduct any type of flood study without consulting these communities. And to continue to do so after the failing was pointed out to them is explicitly racist.""",,race,,02r-21-r5 complaint (pdf) (69.05 kb),epa,,,,
fy21,04x-21-r4,closed,both,south carolina agencies,2021-05-25,2023-06-13,749.0,rejected 7/7/2021: lack of information/complainant non-responsive,rejected,rejected,True,lack of information/complainant non-responsive,Biden,"None listed; it appears to be about the impact of a false police report on a disadvantaged business enterprise application, or at least both items are mentioned",Charleston,SC,29403,Not mentioned,,yes,No,Redacted individual,,No,No,"Cites a false police report, not environmental discrimination",,1.0,,https://www.epa.gov/system/files/documents/2022-06/04X-21-R4%20Complaint_Redacted.pdf,,,,,04x-21-r4 complaint (pdf) (8.07 mb),epa,,,,
fy21,03r-21-r4,active,both,tenn. dept. of envir. and conservation,2021-05-21,2023-06-13,753.0,pending: in informal resolution agreement negotiation,pending,pending: in informal resolution agreement negotiation,False,,Biden,"Issuing a permit for a proposed crude oil pipeline ""that would run directly through the municipal wellfield that supplies drinking water for historic Black neighborhoods in Memphis"" (southwest Memphis, specifically)",Memphis,TN,"38109, others",Primarily Black residents,,yes,Yes,Southern Environmental Law Center,Memphis Community Against Pollution Inc.,No,Yes,,,1.0,,https://www.epa.gov/system/files/documents/2022-06/03R-21-R4%20Complaint_Redacted.pdf,"""The proposed route cuts through the heart of Boxtown, a freedmen’s community established by formerly enslaved people following the Emancipation Proclamation of 1863.15 Residents in the neighborhood’s zip code, 38109, are 97% Black,16 and nearly half of the households have an income below $25,000 a year. ... Rather than lead Byhalia to look elsewhere, the environmental injustice in southwest Memphis is precisely why Byhalia chose this route. ... Explaining the circuitous route to landowners, a  land agent disclosed that Byhalia saw southwest Memphis—poor, Black, already polluted—as the 'point of least resistance.'""",,race,,03r-21-r4 complaint (pdf) (2.22 mb),epa,,,,
fy21,02ad-21-r4,closed,both,epa region 4,2021-03-26,2021-04-30,35.0,rejected 4/30/2021: lack of jurisdiction,rejected,rejected,True,Lack of jurisdiction,Biden,"EPA won't start a Cumulative Risk Health Assessment for veterans exposed to toxics at the former Army base of Fort McClellan, Alabama",Anniston,AL,36201,"Veterans, older people",,yes,No,Redacted individual,,No,Yes,,,1.0,,https://www.epa.gov/system/files/documents/2022-06/02AD-21-R4%20Complaint_Redacted.pdf,"""The veterans do hereby allege that the unified refusal to cooperate with a valid access attempt by the veterans to commence a Cumulative Risk Health Assessment project at the EPA, has amounted to a discrimination practice to block, refuse, and deny legitimate agency services by reason of their environmental toxic exposures related health conditions, handicaps, and disabilities which are medically matching to the known and documented toxic sources from the former Army base of Fort McClellan, Alabama."" The complaint said no one responded to multiple requests for information and help. Separate -- link to some details about toxic exposures there: https://www.publichealth.va.gov/exposures/fort-mcclellan/",,disability, age,02ad-21-r4 complaint (pdf) (791.14 kb),epa,,,,
fy21,02r-21-r3,active,both,"philadelphia dept. of health, pa",2021-03-05,2023-06-13,830.0,pending: in informal resolution agreement negotiation,pending,pending: in informal resolution agreement negotiation,False,,Biden,"Agency issued a permit to a gas-fueled power plant in the Nicetown neighborhood, ""already heavily burdened with toxic air emissions from multiple sources""",Philadelphia,PA,19140,Primarily Black residents,,yes,Unclear (possibly),"Pennsylvanians Organized to Witness, Empower, and Rebuild",,No,Yes,,,1.0,,https://www.epa.gov/system/files/documents/2022-06/02R-21-R3%20Complaint_Redacted.pdf,,,race,,02r-21-r3 complaint (pdf) (296.4 kb),epa,,,,
fy21,01r-21-r4,closed,both,"town of trenton, nc",2021-03-05,2021-03-22,17.0,rejected 3/22/2021: lack of jurisdiction,rejected,rejected,True,Lack of jurisdiction,Biden,"Two schools built in communities of color were not permitted to connect to the public sewage system, resulting in septic tank overflows that made students and teachers sick. (Dates given are 1951-2017)",Trenton,NJ,not mentioned,Communities of color,,yes,No,Redacted individual,,No,Yes,A past issue; there would be a timeliness issue if not a jurisdictional one,,1.0,,https://www.epa.gov/system/files/documents/2022-06/01R-21-R4%20Complaint_Redacted.pdf,,,race,,01r-21-r4 complaint (pdf) (1.17 mb),epa,,,,
fy21,01r-21-r3,closed,both,"city of ranson, wv",2021-01-08,2021-01-28,20.0,rejected 1/28/2021: lack of jurisdiction,rejected,rejected,True,Lack of jurisdiction,Biden,Rezoning and other actions/inactions affecting Black cemeteries,Kearneysville,WV,25430,Black residents and deceased residents,,yes,Unclear,Rural Agricultural Defenders,,No,Yes,,Possibly,2.0,"03R-19-R3, 04R-19-R3",https://www.epa.gov/system/files/documents/2022-06/01R-21-R3%20Complaint_Redacted.pdf,,,race,,01r-21-r3 complaint (pdf) (46.86 mb),epa,,,,
fy21,01rno-21-r5,active,both,illinois epa,2021-01-06,2023-06-13,888.0,pending: in informal resolution agreement negotiation,pending,pending: in informal resolution agreement negotiation,False,,Biden,Issuing a permit for a metal shredder and related operations,Chicago,IL,60617,Residents of color,,yes,Yes,Greater Chicago Legal Clinic; Environmental Advocacy Clinic at the Northwestern Pritzker School of Law,Southeast Environmental Task Force; Chicago Southeast Side Coalition to Ban Petcoke,No,Yes,,,1.0,,https://www.epa.gov/system/files/documents/2022-06/01RNO-21-R5%20Complaint_Redacted.pdf,"From the complaint: ""These commentators assert that the EJ area where the facility will operate is already characterized by air quality challenges like toxic metal emissions to which the facility will add. This concern includes emissions from several colocated and co-owned scrap processing facilities that were not included by Illinois EPA in its permitting process. Commentators expressed concerns about the air quality impacts posed by the hundreds of trucks that are needed to bring materials to the facility and to remove processed materials from the facility, especially on local PM-10 ambient air quality conditions. Because the permitted facility is transferring the business, operations and equipment from an existing metal shredder on Chicago’s northside, dozens of commentators provided detailed information about the troubled compliance history of this northside operation and urged Illinois EPA to develop measures to address recurrent problems. Equally important, they questioned Illinois EPA’s permitting process, which occurred during a pandemic, a period of local civil unrest and without translation services in a community where many residents are Spanish-speaking. """,,race, national origin,01rno-21-r5 complaint (pdf) (175 kb),epa,,,,
fy21,01r-21-r9,resolved/in monitoring,both,"bay area air quality monitoring district, ca",2020-11-30,2022-10-03,672.0,resolved with voluntary compliance agreement 10/03/2022: in monitoring,resolved,resolved: voluntary compliance agreement,False,,Biden,"Agencies failed to ""mitigate and monitor the surrounding community’s exposure to dust disturbances"" from redevelopment of a former Navy site contaminated with radionuclides, oils, solvents and asbestos.",San Francisco,CA,94124,"Asian, Black and Latino residents",,yes,Unclear,Redacted groups or individuals,,No,Yes,,Yes,2.0,"01r-21-r9, 02r-21-r9",https://www.epa.gov/system/files/documents/2022-06/01R-21-R9%20Complaint_Redacted_1.pdf,,,race,,01r-21-r9 complaint (pdf) (11.67 mb) 01r-21-r9 rec acceptance (pdf) (194.64 kb) 01r-21-r9 vca rec letter (pdf) (201.07 kb) 01r-21-r9 vca final (pdf) (243.59 kb),epa,,,,
