fy_rec'd,epa_file_#,summary_status,_merge,named_entity,clean_date_received,recent_status_date,time_difference,detailed_status,primary_status_map,simplified_status,compare_statuses,reason_for_rejection_if_applicable,presidential_administration,environmental_justice_issue_cited,city,state,zip_code,community_impacted,referred_agency,is_unique,filed_by_a_lawyer,group_filing,filed_on_behalf_of,epa_initiated_compliance_review,complaint_about_environmental_justice_matter,notes_on_ej_categorization,more_than_one_complaint,total_related_complaints,related_complaint_numbers,complaint_link,notes,additional_notes,disc_basis_1,disc_basis_2,related_documents,origin,final_adjudication_&_reason,disc_basis_3,disc_basis_4,disc_basis_5
fy15,25r-15-r6,closed,both,stella-jones inc. colfax treating co. (la),2015-08-23,2017-09-29,768.0,rejected 9/29/2017: lack of jurisdiction – referred epa region 6 (existing contact),rejected,rejected and referred: within EPA,False,Lack of jursdiction,Trump,"Black community is hemmed in by two creosote plants; people are ""sick and dying from creosote contamination and chemicals related diseases."" ",Alexandria,LA,71302,Predominantly Black community,,Yes,No,Redacted individual,,No,Yes,,,1.0,,https://www.epa.gov/system/files/documents/2022-08/25R-15-R6%20Complaint%20Redacted.pdf,https://www.ehstoday.com/archive/article/21904741/louisiana-lawsuits-claim-companies-caused-serious-health-problems,https://www.thetowntalk.com/story/news/local/2015/05/05/honor-urges-alexandria-health-survey-creosote-impact/26964969/,race,,25r-15-r6 complaint (pdf) (104.65 kb),epa,,,,
fy15,24u-15-r4,closed,both,pipe masters (nc),2015-08-22,2016-03-17,208.0,"rejected 3/17/2016: lack of jurisdiction, lack of discrim. act",rejected,rejected,True,"lack of jurisdiction, lack of discriminatory act",Obama,"Company is ""forcing [employees] to vent freon into the air [when] working.""",not disclosed,NC,not disclosed,workers,,Yes,No,Redacted individual,,No,No,It sounds like an OSHA complaint; no discrimination cited,,1.0,,https://www.epa.gov/system/files/documents/2022-08/24U-15-R4%20Complaint%20Redacted.pdf,,,,,24u-15-r4 complaint (pdf) (57.65 kb),epa,,,,
fy15,23u-15-r9,closed,both,"double tree hotel (sacramento, ca)",2015-08-12,2016-02-02,174.0,"rejected 2/2/2016: lack of jurisdiction, lack of discrim act – suggested contact calif. dph, indoor air quality section",rejected,rejected,True,"lack of jurisdiction, lack of discriminatory act",Obama,"Complainant stayed in a hotel room that ""smelt heavily of mold""",Sacramento,CA,not disclosed,hotel visitors,,Yes,No,Redacted individual,,No,No,It's a complaint about mold in a hotel room,,1.0,,https://www.epa.gov/system/files/documents/2022-08/23U-15-R9%20Complaint%20Redacted.pdf,,,,,23u-15-r9 complaint (pdf) (12.68 kb),epa,,,,
fy15,22x-15-r6,closed,both,"village villas (hot springs, ar)",2015-08-06,2016-01-20,167.0,"rejected 1/20/2016: lack of jurisdiction, lack of discrim act – suggested contact hot springs nuisance abatement office",rejected,rejected,True,"lack of jurisdiction, lack of discriminatory act",Obama,"Apartment complex isn't dealing with bats and bat waste, sickening the residents because of exposure to Histoplasmosis",Hot Springs,AR,71910,residents,,Yes,Yes,Attorney Charles Matthews,redacted individuals,No,No,Complaint is about bat waste at an apartment,,1.0,,https://www.epa.gov/system/files/documents/2022-08/22X-15-R6%20Complaint%20Redacted.pdf,,,,,22x-15-r6 complaint (pdf) (394.24 kb),epa,,,,
fy15,18r-15-r5,closed,both,illinois epa – agrifine,2015-07-23,2016-01-27,188.0,admin closure (withdrawn): 1/27/2016,,closed: complaint withdrawn,False,,Obama,"State agency discriminated by failing to incorporate public participation in its permitting for Agri-Fine, which operates and pollutes in an environmental justice community",Chicago,IL,60617,Black and Latino community,withdrawn,Yes,Yes,Southeast Environmental Task Force; the Southeast Side Coalition to Ban Petcoke,,No,Yes,,,1.0,,https://www.epa.gov/system/files/documents/2022-08/18R-15-R5%20Complaint.pdf,,,race,,18r-15-r5 complaint (pdf) (13.88 mb),epa,,,,
fy15,21u-15-r4,closed,both,alabama dept. of corrections,2015-07-21,2015-08-27,37.0,rejected and referred (doj) 8/27/2015: lack of jurisdiction,rejected and referred,rejected and referred,True,Lack of jurisdiction,Obama,Mention of clean-air concerns in the prison because of handmade cigarettes prisoners are smoking,Harvest,AL,35749,inmates,doj,Yes,No,Redacted individual,,No,No,Complaint about smoking,,1.0,,https://www.epa.gov/system/files/documents/2022-08/21U-15-R4%20Complaint%20Redacted.pdf,,,,,21u-15-r4 complaint (pdf) (1.2 mb),epa,,,,
fy15,20u-15-r6,closed,both,"broken arrow, ok area",2015-07-10,2015-08-10,31.0,"rejected 8/10/2015: no recipient named, no discriminatory act",rejected,rejected,True,"no recipient named, lack of discriminatory act",Obama,Bed bugs; complainant asks the EPA for help,Broken Arrow,OK,74012,complainant's family,,Yes,No,Redacted individual,,No,No,"Not an exposure issue, no protected class mentioned, no entity mentioned",,1.0,,https://www.epa.gov/system/files/documents/2022-08/20U-15-R6%20Complaint%20Redacted.pdf,,,,,20u-15-r6 complaint (pdf) (281.8 kb),epa,,,,
fy15,15u-15-r4,closed,both,nc dept. of public safety - eastern corr. inst,2015-06-30,2015-08-21,52.0,"rejected and referred (doj, nc dhhs, dol/osha) 8/21/2015: lack of jurisdiction",rejected and referred,rejected and referred,True,Lack of jurisdiction,Obama,"Because of asbestos in Eastern Correctional Unit, the air vents/ducts haven't been cleaned since the prison opened in 1982, leaving people there breathing 33 years of ""accumulated filth""; complainant was housed there earlier and suffered from sinus issues as well as getting exposed to the abestos while working in maintenance",Maury,NC,28554,inmates,"doj, nc dhhs, dol/osha",Yes,No,Redacted individual,,No,Possibly,The asbestos exposure sounds like an OSHA complaint; not sure how the EPA might handle a general bad-air issue that isn't about pollution per se,,1.0,,https://www.epa.gov/system/files/documents/2022-08/15U-15-R4%20Complaint%20Redacted.pdf,,,,,15u-15-r4 complaint (pdf) (1.56 mb),epa,,,,
fy15,16d-15-r3,closed,both,philadelphia county (pa) assistance office,2015-06-29,2015-07-22,23.0,rejected and referred (hhs) 7/22/2015: lack of jurisdiction,rejected and referred,rejected and referred,True,Lack of jurisdiction,Obama,Complaint is about insurance,Philadelphia,PA,19103,Person with disabilities,hhs,Yes,No,Redacted individual,,No,No,Complainant was trying to get their insurance switched and got the runaround,,1.0,,https://www.epa.gov/system/files/documents/2022-08/16D-15-R3%20Complaint%20Redacted.pdf,,,disability,,16d-15-r3 complaint (pdf) (1.61 mb),epa,,,,
fy15,13u-15-r4,closed,both,nc dept. of public safety - pamlico corr. inst,2015-06-24,2015-08-20,57.0,rejected and referred (doj) 8/20/2015: lack of jurisdiction,rejected and referred,rejected and referred,True,Lack of jurisdiction,Obama,"Pamlico Correctional Institution has ""mold fungi and mildew and possible asbestos dust particles"" in the ventilation system, endangering inmates and staff, and refushed to flush the system because of cost. Complainant also complained to OSHA.",Bayboro,NC,28515,inmates,doj,Yes,No,Redacted individual,,No,Possibly,"Another complaint about asbestos at a prison, this one general rather than about work exposure",,1.0,,https://www.epa.gov/system/files/documents/2022-08/13U-15-R4%20Complaint%20Redacted.pdf,https://www.epa.gov/system/files/documents/2022-08/13U-15-R4%20Second%20letter%20from%20complainant_Letter%20to%20OSHA%20Redacted.pdf,,,,13u-15-r4 complaint (pdf) (579.5 kb) 13u-15-r4 complaint supplement (pdf) (924.2 kb),epa,,,,
fy15,14u-15-r3,closed,both,kinzer drilling; energy corp; wv dept. of envir. prot. - abandoned mines office,2015-06-24,2023-06-13,2911.0,"rejected 3/17/2017: lack of jurisdiction (kinzer, energy corp); lack of discrim. act (wvdep) – suggested contact doi/osmre, wv enviro council, wv rivers coalition",rejected,rejected,True,"Lack of jurisdiction, lack of discriminatory act",Trump,"Hard-to-read handwritten letters; complainant's home was damaged with water and mold, which (based on a letter they included from a company they complained to) they attributed to blasting or underground mining",Williamson,WV,25661,complainant,,Yes,No,Redacted individual,,No,No,No protected class mentioned and the complaint is unclear as to the cause of the damage,,1.0,,https://www.epa.gov/system/files/documents/2022-08/14U-15-R3%20Complaint%20Redacted.pdf,"https://www.epa.gov/system/files/documents/2022-08/14U-15-R3%20Supp1%20Redacted.pdf
epa.gov/system/files/documents/2022-08/14U-15-R3%20Supp2%20Redacted.pdf",,,,14u-15-r3 complaint (pdf) (1.46 mb) 14u-15-r3 complaint supp 1 (pdf) (6.37 mb) 14u-15-r3 complaint supp 2 (pdf) (763.76 kb),epa,,,,
fy15,12u-15-r5,closed,both,auto body shop (in),2015-06-09,2023-06-13,2926.0,"rejected 4/14/2016: lack of discriminatory act, suggested contact u.s. dol/osha",rejected,rejected,True,lack of discriminatory act,Obama,Concerns about possible contamination related to an autobody shop,Brownsburg,IN,46112,complainant,,Yes,No,Redacted individual,,No,Possibly,"No protected class mentioned, no discrimination cited",,1.0,,https://www.epa.gov/system/files/documents/2022-08/12U-15-R5%20Complaint%20Redacted.pdf,https://www.epa.gov/system/files/documents/2022-08/12U-15-R5%20Response%20to%202nd%20Request%20Redacted.pdf,,,,12u-15-r5 complaint (pdf) (423.75 kb) 12u-15-r5 complaint supplement (pdf) (727.57 kb),epa,,,,
fy15,11d-15-r3,closed,both,winn apts. (dc),2015-06-08,2015-08-20,73.0,"rejected and referred (dc dept. of health, dc dept. of consumer and reg affairs) 8/20/2015: lack of jurisdiction",rejected and referred,rejected and referred,True,Lack of jurisdiction,Obama,Chronic flooding in apartment is causing mold and other issues,Washington,DC,20032,Person with a disability,"dc dept. of health, dc dept. of consumer and reg affairs",Yes,No,Redacted individual,,No,No,It's a property and health issue; EPA referred to local health department,,1.0,,https://www.epa.gov/system/files/documents/2022-08/11D-15-R3%20Complaint%20Redacted.pdf,,,disability,,11d-15-r3 complaint (pdf) (792.45 kb),epa,,,,
fy15,17x-15-r5,closed,both,"rainforest inquiry (jefferson es 4th graders, rochester, minn.)",2015-05-27,2015-08-20,85.0,referred to epa office of envir. education on 8/20/2015 for response – not a complaint,rejected and referred,referred: not a complaint,False,N/A (not a complaint),,Two fourth-grade students write the EPA generally (not this office specifically) with concerns about rainforests being cut down,Rochester,MN,not disclosed,The world,epa office of envir. education on ,,No,Fourth-grade students,,No,No,"Students with a general environmental concern, not complaints",,1.0,,https://www.epa.gov/system/files/documents/2022-08/17X-15-R5%20Letter1%20Redacted.pdf,https://www.epa.gov/system/files/documents/2022-08/17X-15-R5%20Letter2%20Redacted.pdf,,,,17x-15-r5 rainforest inquiry 1 (pdf) (508.62 kb) 17x-15-r5 rainforest inquiry 2 (pdf) (354.5 kb),epa,,,,
fy15,19r-15-r2,closed,both,nj dept. of envir. prot. – trenton hs,2015-05-26,2018-09-14,1207.0,rejected 9/14/2018: investigation unwarranted – actions already taken,rejected,rejected,True,investigation unwarranted – actions already taken,Trump,"Complainant says the agency approved a school demolition without requiring project managers to perform the same due diligence, including protecting the surrounding area from asbestos, ""that would normally be done for a project of this magnitude in a wealthy or predominantly white neighborhood."" The surrounding area is a low-income community of color.",Trenton,NJ,not disclosed,Low-income community of color,,Yes,No,Redacted individual,,No,Yes,,,1.0,,https://www.epa.gov/system/files/documents/2022-08/19R-15-R2%20Complaints%20Redacted.pdf,https://www.epa.gov/system/files/documents/2022-08/19R-15-R2%20Web%20Complaint%20Redacted.pdf,"""The New Jersey Department of Environmental Protection and New Jersey Department  of Community Affairs engaged in racial discrimination by jeopardizing the health and safety of residents near Trenton Central High School.""",race,,19r-15-r2 complaints (pdf) (308.88 kb) 19r-15-r2 web complaints (pdf) (99.3 kb),epa,,,,
fy15,10u-15-r8,closed,both,north dakota dept. of agriculture,2015-04-13,2015-07-08,86.0,rejected and referred (usda) 7/8/2015: lack of jurisdiction,rejected and referred,rejected and referred,True,Lack of jurisdiction,Obama,Complainant tried to go through state mediation over a pesticide application that killed their crop and found the proceedings biased,Mooreton,ND,58061,complainant,usda,Yes,No,Redacted individual,,No,No,"No mention of discrimination or a protected class (and the complaint doesn't seem to be about environmental exposure, just crop loss)",,1.0,,https://www.epa.gov/system/files/documents/2022-08/10U-15-R8%20Complaint%20Redacted.pdf,,,,,10u-15-r8 complaint (pdf) (1.35 mb) 10u-15-r8 complaint attachments (pdf) (1.47 mb) 10u-15-r8 complaint supplement (pdf) (2.42 mb),epa,,,,
fy15,09r-15-r9,closed,both,calif. epa/dept. of toxic substances control,2015-03-19,2016-09-13,544.0,resolved and closed through adr settlement: 9/13/2016,resolved,resolved: alternative dispute resolution settlement,False,,Obama,"Agencies approved an expasion of the Chemical Waste Management Kettleman Hills Hazardous Waste Facility ""through use of flawed, defective and racially discriminatory procedures, studies and permit processes""; the expansion would increase diesel truck traffic, worsening already high leveles of asthma in the city, and increase the risk of hazardous waste contamination. State relied on county's process, which was entirely in English despite requests for Spanish-language options; ""documents were adopted through the use of these racially discriminatory procedures and by a large scale and intimidating police presence including police dogs.""",Kettleman City,CA,not disclosed,Latino and Spanish-speaking residents,,Yes,Yes,El Pueblo para el Aire y Agua Limpia; Greenaction for Health and Environmental Justice,,No,Yes,,,1.0,,https://www.epa.gov/system/files/documents/2022-08/09R-15-R9%20Complaint%20NR.pdf,"""The agreement is one of the first examples of a voluntary resolution jointly developed by state agencies and community groups under Title VI of the federal Civil Rights Act, which prohibits discrimination on the basis of race, color or national origin in any programs or activities receiving federal financial assistance."" Link: https://dtsc.ca.gov/2016/08/10/landmark-agreement-reached-to-benefit-environmental-justice-communities-and-resolve-a-civil-rights-complaint-on-hazardous-waste-permitting-decision/",,race,,09r-15-r9 complaint (pdf) (2.16 mb),epa,,,,
fy15,08r-15-r4,resolved/in monitoring,both,jefferson co. (al) dept. of health – walter coke,2015-03-02,2019-07-02,1583.0,resolved through informal resolution agreement: 7/2/2019; in monitoring,resolved,resolved: informal resolution agreement,False,,Trump,"County agency approved a permit for a coke facility (a type of coal residue), impacting the Black residents in the adjacent community ""without justification""",Birmingham,AL,35207,Black community,,Yes,Yes,Law office of David A. Ludder,GASP; Greater Birmingham Ministries; PANIC (People Against Neighborhood Industrial Contamination); redacted individuals,No,Yes,,,1.0,,https://www.epa.gov/system/files/documents/2022-08/08R-15-R4%20Complaint_Redacted.pdf,,,race,,08r-15-r4 complaint (pdf) (11.66 mb),epa,,,,
fy15,07r-15-r6,closed,both,baton rouge (la),2015-02-25,2016-08-31,553.0,rejected 8/31/2016: lack of discriminatory act,rejected,rejected,True,lack of discriminatory act,Obama,"Complainant says the community ""is forced to live in human waste sewage air pollution for many years""",Baton Rogue,LA,not disclosed,Black community,,Yes,No,Concerned Citizens of University Place Subdivision,,No,Yes,"Not much detail on the situation in the letter, but CPI wrote about the situation based on an earlier complaint: https://publicintegrity.org/environment/pollution/environmental-justice-denied/environmental-racism-persists-and-the-epa-is-one-reason-why/",,2.0,"08r-16-r6, 07r-15-r6",https://www.epa.gov/system/files/documents/2022-08/07R-15-R6%20Complaint%20Redacted.pdf,,,race,,07r-15-r6 complaint (pdf) (234.65 kb),epa,,,,
fy15,06r-15-r6,closed,both,ameripure oyster plant; city of franklin (la),2015-02-24,2016-02-11,352.0,"rejected 5/5/2015 & 2/11/2016: lack of jurisdiction, untimely filed",rejected,rejected,True,"Lack of jurisdiction, untimely",Obama,"Referred to the EPA by the DOJ; company spread oyster shells on their parking lot, drawing buzzards; ""the stink and the flies was and still is horrible."" Rain spreads the stink directly into complainant's yard. Company put a large butene tank near complainant's home. Truck traffic is constant. ""It's plain to see that this is environmental racism.""",Franklin,LA,not disclosed,Black community,,Yes,No,NAACP of St. Mary,Redacted individual,No,Yes,,,1.0,,https://www.epa.gov/system/files/documents/2022-08/06R-15-R6%20Complaint%20Redacted.pdf,,,race,,06r-15-r6 complaint (pdf) (2.22 mb),epa,,,,
fy15,05d-15-r6,closed,both,laredo (tx); webb co. (tx) utilities dept.; tceq,2015-02-18,2016-01-21,337.0,"rejected 1/21/2016: lack of jurisdiction (city and county), lack of discriminatory act",rejected,rejected,True,"Lack of jurisdiction, lack of discriminatory act",Obama,"Referred to the EPA by the DOJ; complaint's letter is partially cut off, but the issue has to do with pipes that ""release toilet fumes"" into their home ",Laredo,TX,78040,Person with a disability,,Yes,No,Redacted individual,,No,No,Issue related to faulty plumbing ,,1.0,,https://www.epa.gov/system/files/documents/2022-08/05D-15-R6%20Complaint%20Redacted.pdf,,,disability,,05d-15-r6 complaint (pdf) (2.25 mb),epa,,,,
fy15,04r-15-r4,closed,both,ala. dept. of corrections – limestone corr. fac.,2015-02-09,2015-04-03,53.0,rejected and referred (doj) 4/3/2015: lack of jurisdiction,rejected and referred,rejected and referred,True,Lack of jurisdiction,Obama,"Asbestos and radon exposure in Alabama prisons: All state prisons have friable asbestos exposure and several ""are built on landfill property and some on old coal mines. Raw sewage is discharged into the Black Warrior River and creeks by various prisons. Due to ventilation issues, Alabama prisons smell like ""methane gas and sewer gas.""",statewide,AL,multiple,inmates,doj,Yes,No,Redacted individual,,No,Yes,"No protected class mentioned, but there probably is one",,1.0,,https://www.epa.gov/system/files/documents/2022-08/04R-15-R4%20Complaint%20Redacted.pdf,,,,,04r-15-r4 complaint (pdf) (557.44 kb),epa,,,,
fy15,03r-15-r4,resolved/in monitoring,both,jefferson co. (al) dept. of health – abc coke,2015-02-06,2019-07-02,1607.0,resolved through informal resolution agreement: 7/2/2019; in monitoring,resolved,resolved: informal resolution agreement,False,,Trump,"County agency approved a permit for a coke facility (a type of coal residue), impacting the Black residents in the adjacent community. (This is one of two such complaints involving different coke facilities.)",Birmingham,AL,35207,Black community,,Yes,Yes,Law office of David A. Ludder,GASP; Greater Birmingham Ministries; PANIC (People Against Neighborhood Industrial Contamination); redacted individuals,No,Yes,,,1.0,,https://www.epa.gov/system/files/documents/2022-08/03R-15-R4%20Complaint%20Redacted.pdf,Residents were not happy with the settlement: https://birminghamwatch.org/epa-overrides-civil-rights-complaint-jcdh-adding-residents-frustration/,,race,,03r-15-r4 complaint (pdf) (12.25 mb),epa,,,,
fy15,02r-15-r3,closed,both,balt. county (md) dept. of public works,2015-01-23,2015-03-31,67.0,rejected 3/31/2015: lack of current jurisdiction,rejected,rejected,True,Lack of current jurisdiction,Obama,"Note: Appears to have been filed with the Federal Highway Administration originally (unclear if referred or cross-filed). Agency has a ""discriminatory allocation of curbing and sewers for roads and residential developments in Baltimore County. For example, comparing the adjacent Caucasian neighborhood of Oak Park and the complainant’s African-American neighborhood in Halethorpe, predominantly all of the blocks in Oak Park have curbs and sewers, whereas fewer than half of the blocks in the complainant’s neighborhood had curbs and sewers. ...  Indeed, the development of Oak Park exacerbated the runoff to – and thus caused residential flooding in – the adjacent, downhill [redacted] in complainant’s African-American neighborhood.""",Halethorpe,MD,not disclosed,Predominantly Black community,,Yes,Yes,Attorney Lawrence J. Joseph,Redacted individual,No,Yes,,,1.0,,https://www.epa.gov/system/files/documents/2022-08/02R-15-R3%20Complaint%20Redacted.pdf,"""The complainant anticipates that BCPWD will claim that it bases its allocation of curbing and sewers on factors other than race, such as requiring new developments to pay for those services as part of the construction process. Even assuming that that were true, BCPWD cannot deny either (1) that a “services-to-new-developments” policy disparately impacts older, minority neighborhoods, or (2) the development of the Oak Park neighborhood on wetlands exacerbated the runoff to and thus also caused residential flooding in complainant’s adjacent, downhill African-American neighborhood.""",,race,,02r-15-r3 complaint (pdf) (659.74 kb),epa,,,,
fy15,01r-15-r4,closed,both,alabama dept. of corrections,2015-01-05,2015-03-27,81.0,rejected and referred (doj) 3/27/2015: lack of jurisdiction,rejected and referred,rejected and referred,True,Lack of jurisdiction,Obama,State isn't enforcing nonsmoking laws in Alabama prison,not disclosed,AL,not disclosed,inmates,doj,Yes,No,Redacted individual,,No,No,It's about smoking. No protected class mentioned.,,1.0,,https://www.epa.gov/system/files/documents/2022-08/01R-15-R4%20Complaint_Redacted.pdf,Appears to be filed by the same person who filed the other Alabama prison complaint about smoking: 21u-15-r4,,,,01r-15-r4 complaint (pdf) (3.84 mb),epa,,,,
fy14,21r-14-r9,closed,both,"guam office, u.s. epa; u.s. epa region 9",2014-12-08,2015-05-13,156.0,"rejected 5/13/2015: lack of recipient (epa is not “recipient” under the civil rights laws), no timeframe identified for discriminatory act",rejected,rejected,True,"lack of jurisdiction, no timeframe identified for discriminatory act",Obama,Says Guam is disproportionately affected by a programmatic condition that states and tribes responding to a survey don't have to get approval from EPA to spend certain funds because (I think) Guam was not included in the survey,Barrigada,GU,96921,Pacific Islanders,,Yes,No,Redacted individual,,No,No,"It's about EPA funding rules. So it doesn't count as an EJ complaint under EPA's rules, but beyond that, it's not about pollution or other environmental impacts.",,1.0,,https://www.epa.gov/system/files/documents/2022-08/21R-14-R9%20Complaint_Redacted.pdf,,,race,,21r-14-r9 complaint (pdf) (554.32 kb),epa,,,,
fy14,20r-14-r4,closed,both,city of chattanooga-hamilton co air pollution control bureau (tn),2014-11-06,2016-02-11,462.0,"rejected 2/11/2016: discriminatory act unclear, untimely filed",rejected,rejected,True,"discriminatory act unclear, untimely",Obama,"Referred by DOJ. Complaining groups say ""false allegations of EPA regulatory violations"" made by the Chattanooga-Hamilton County Air Pollution Control Bureau, related to asbestos removal, resulted in criminal charges for an African American person. Groups say the agency is engaged in racial discrimination and environmental racism, has falsified documents and selectively enforces EPA regulations on toxic waste removal in the African American community.",Chattanooga,TN,37415,,,Yes,Possibly,National Action Network; Southern Christian Leadership Conference; redacted groups/individuals,,No,Yes,But note that this wasn't intended to be an EPA EJ complaint. It was filed with the DOJ.,,1.0,,https://www.epa.gov/system/files/documents/2022-08/20R-14-R4%20Complaint_Redacted.pdf,"Was sent to DOJ in 2012 as a request for a meeting and intervention; didn't get referred to EPA until 2014. One of the reasons EPA rejected it: ""untimely filed.""",,race,,20r-14-r4 complaint (pdf) (13.55 mb),epa,,,,
fy14,19no-14-r1,closed,both,mass. dept. of envir. prot.,2014-10-29,2016-07-29,639.0,"admin closure 7/29/2016: lack of discriminatory act, lack of complainant to clarify",,rejected,False,"lack of discriminatory act, lack of complainant to clarify",Obama,Email with concerns about the agency's access options for people with limited English proficiency,not disclosed,MA,not disclosed,Limited English proficiency residents,,Yes,No,Redacted individual,,No,Yes,"Classified this as ""yes"" because the email's reference to LEP access issues does seem to fall within the parameters of EPA's EJ focus. But it's a short email rather than a full complaint, so further details aren't available.",,1.0,,https://www.epa.gov/system/files/documents/2022-08/19NO-14-R1%20Complaint_Redacted.pdf,,,national origin,,19no-14-r1 complaint (pdf) (118.03 kb),epa,,,,
fy14,18r-14-r4,closed,both,city of flovilla (ga),2014-10-23,2015-08-28,309.0,rejected 8/28/2015: lack of discriminatory act,rejected,rejected,True,lack of discriminatory act,Obama,"Referred by OSHA; this is an employment termination complaint. Complainant said they were fired by the city for raising concerns about poor quality of the drinking water, lack of safety training/supplies and time-off decisions.",Flovilla,GA,30216,not mentioned,,Yes,No,Redacted individual,,No,Possibly,It mentions water quality but not any affected people/groups,,1.0,,https://www.epa.gov/system/files/documents/2022-08/18r-14-R4%20Complaint_Redacted.pdf,,,retaliation,,18r-14-r4 complaint (pdf) (1.24 mb),epa,,,,
